message,label
put party day week study lightly think need draw custom checkboxes know hardcore,0
havent stuck orchard dad car going dinner u leh r free tonight,0
nice day today love dearly,0
aight let know youre gon na around usf,0
probably ltgt,0
aiyar hard type u later free tell call n scold n tell u,0
customer place call,0
going film day da pm sorry da,0
shop till u drop either k k £ cash £ travel voucher call ntt po box crbt fixedline cost ppm mobile vary,1
howz painit come todaydo said ystrdayice medicine,0
ok many buy,0
pls pls send mail know relative coming deliver know cost risk benefit anything else thanks,0
yo carlos friend already asking working weekend,0
sent like,0
slept thinkthis time ltgt pm dangerous,0
thank god bed,0
playng door game gt racing phone lol,0
probably wont eat today think im gon na pop weekend u miss,0
lot sickness thing going round take easy hope u feel better soon lol,0
guess ltgt min,0
together thinkin,0
hey whats plan sat,0
sorry ill call later,0
hey j r u feeling better hopeso hunny amnow feelin ill ithink may tonsolitusaswell damn iam layin bedreal bored lotsof luv xxxx,0
urgent week free membership £ prize jackpot txt word claim tc wwwdbuknet lccltd pobox ldnwarw,1
dont forget though love walk beside watching keeping heart warm,0
winner specially selected receive £ cash £ award speak live operator claim call ampm cost p,1
pls make note shes exposed also find school anyone else vomiting dog cat house let know later,0
work ah den plus lor u workin oso rite den go orchard lor place go liao,0
ur awarded city break could win £ summer shopping spree every wk txt store skilgmetscswinawkage£perwksub,1
ya ok vikky vl c witin ltgt min il reply u,0
even friend priest call,0
tmr ü brin lar aiya later come n c lar mayb ü neva set properly ü got da help sheet wif ü,0
er mw im filled tuth aight,0
u definitely need module e humanity dis sem izzit u wan take module st,0
u coming funeral home,0
lol u drunkard hair moment yeah still tonight wats plan,0
good friend care close friend understand true friend stay forever beyond word beyond time gud ni,0
u guy never invite anywhere,0
everybody fun evening miss,0
ha ha ha good joke girl situation seeker,0
trying find chinese food place around,0
en chikku nange bakra msg kalstiyathen teacoffee,0
sorry got thing may pub later,0
hard live chat pmin choose girl connect live call cheap chat uk biggest live service vu bcmwcnxx,1
per request melle melle oru minnaminunginte nurungu vettam set callertune caller press copy friend callertune,0
use soc use home ü dunno type word ar,0
decided people care stuff vote caring stuff loser,0
spending new year brother family let plan meet next week ready spoiled,0
unique enough find th august wwwareyouuniquecouk,1
feb ltgt love u day send dis ur valued frnds evn come back ull gt married person u luv u ignore dis u lose ur luv evr,0
ranjith cal drpd deeraj deepak min hold,0
know grumpy old people mom like better lying always one play joke,0
course math one day one chapter one month finish,0
freeday sexy st george day pic jordantxt pic dont miss every wk saucy celeb pic c pocketbabecouk £wk,1
one day billion class right,0
hmm bit piece lol sigh,0
good luck draw take place th feb good luck removal send stop customer service,1
lol well dont without could big sale together,0
freemsg txt call claim reward hour talk time use phone subscribegbpmnth inc hr stoptxtstop,1
missed call alert number called left message,1
pls pls find aunt nike,0
gr new service live sex video chat mob see sexiest dirtiest girl live ur phone detail text horny cancel send stop,1
done,0
lor change suntec wat time u coming,0
leaving qatar tonite search opportunityall went fastpls add ur prayer dearrakhesh,0
think da wil,0
try neva mate,0
text get ringtones logo game wwwtxtcom question infotxtcouk,1
al moan n e thin go wrong faultal de argument r faultfed himso bother hav go thanxxx,0
im gon na rip uterus,0
think chennai well settled,0
okay ive seen pick friday,0
im work please call,0
pride im almost ltgt year old shouldnt takin money kid youre supposed deal stuff grownup stuffwhy dont tell,0
sorry ill call later,0
ok dear call chechi,0
happened interview,0
wonder world th th ur style th ur smile th ur personality rd ur nature nd ur sm st ur lovely friendship good morning dear,0
hey sorry didntgive ya bellearlier hunnyjust bedbut mite go thepub ltr uwana mt uploads luv jenxxx,0
nokia get win free auction take part send nokia hgsuitelands rowwjhl,1
time want come,0
u missed u havent much bit bored holiday want go bak college sad isnt itxx,0
lol u come idea,0
gon na blake night might able get little early,0
happy new year hope good semester,0
send pic like,0
every king cry baby every great building map imprtant u r today u wil reach tomorw gud ni,0
hi juan im coming home fri hey course expect welcome party lot present ill phone u get back load love nicky x x x x x x x x x,0
like people much shy pa,0
anything lor,0
urgent please call landline abta complimentary tenerife holiday £ cash await collection sae tc box cwwx ppm,1
tirupur da started office call,0
dare change ring,0
think might give miss teaching til twelve lecture two damn working thing,0
callsmessagesmissed call,0
think one saying clearly ok leave need ask go come,0
see film,0
ok shell ok guess,0
make sure alex know birthday fifteen minute far youre concerned,0
yeah probably sure ilol let u know personally wuldnt bother ur goin mite well,0
dad wanted talk apartment got late start omw,0
sarcasm nt scarcasim,0
okie ü wan meet bishan co bishan im driving today,0
asking u knw nt may ur frnds classmate,0
sunshine hols claim ur med holiday send stamped self address envelope drink u uk po box bray wicklow eire quiz start saturday unsub stop,1
important customer service announcement premier call freephone,1
yeah probably still got ta check leo,0
xam hall boy asked girl tell starting term dis answer den manage lot hesitation n lookin around silently said intha ponnungale ipaditan,0
ta job available let know please co really need start working,0
hows pain deary r u smiling,0
im see cant see maybe reboot ym seen buzz,0
rather prominent bite mark right cheek,0
look amy ure beautiful intelligent woman like u lot know u dont like like dont worry,0
love start attractioni feel need every time around meshe first thing come thoughtsi would start day end hershe every time dreamlove every breath namemy life happen around hermy life named heri would cry herwill give happiness take sorrowsi ready fight anyone heri love craziest thing herlove dont proove anyone girl beautiful lady whole planeti always singing praise herlove start making chicken curry end makiing sambarlife beautiful thenwill get every morning thank god day mei would like say lotwill tell later,0
alrite sam nic checkin ur numberso ittb,0
dont think u got think use got good ni,0
rose redred bloodblood heartheart u u send ti ur friend including u like u get back u r poor relation u need support u r frnd many luvs u praying god marry u try,0
housemaid murderer coz man murdered ltgt th january public holiday govtinstituitions closedincluding post officeunderstand,0
amazing quote sometimes life difficult decide whats wrong lie brings smile truth brings tear,0
yup im free,0
youre right think,0
spare power supply,0
slave want take picture today bright light cell phone bright light,0
nokia tone ur mob every week txt nok st tone free get txtin tell ur friend ptone reply hl info,1
sun anti sleep medicine,0
good morning princess great day,0
started skye,0
shopping lor raining mah hard leave orchard,0
aiyar sorry lor forgot tell u,0
wan win meetgreet westlife u currently tour unbreakable untamed unkempt text cost p std text,1
anything lor,0
people tour thought sofa thing sent curious sugar,0
also know lunch menu da know,0
yes trust u buy new stuff asap try,0
okie,0
solve case man found murdered ltdecimalgt ltgt afternoon wife called police police questioned everyone wife siri sleeping murder took place cook cooking gardener picking vegetable housemaid went post office child went play neighbour went marriage police arrested murderer immediately who reply reason u r brilliant,0
stupidits possible,0
tomarrow final hearing laptop case cant,0
famous quote develop ability listen anything unconditionally without losing temper self confidence mean married,0
opinion jada kusruthi lovable silent spl character matured stylish simple pls reply,0
yes posted couple pic fb there still snow outside im waking,0
pick drop carso problem,0
fucking chickened messaged would late woould buzz didnt hear word,0
urgent please call landline £ cash luxury canary island holiday await collection tc sae po box mxy ppm,1
ok u tell wat time u coming later lor,0
nah im perpetual dd,0
pussy perfect,0
told accenture confirm true,0
wait msg ltgt min,0
wen get spiritual deep thats great,0
k dahow many page want,0
ltgt buck bank fee fixed better call bank find,0
idk im sitting stop shop parking lot right bawling eye feel like im failure everything nobody want feel like im failing,0
gon na pick burger way home cant even move pain killing,0
done internet connection v slow ‘ send try later first thing tomo,0
sat right okay thanks,0
customer place wil cal u sir,0
cbe really good nowadayslot shop showroomscity shaping good,0
purity friendship two smiling reading forwarded messageits smiling seeing name gud evng,0
congratulation ur awarded either £ cd gift voucher free entry £ weekly draw txt music tncs wwwldewcom winppmxage,1
hi im sue year old work lapdancer love sex text live im bedroom text sue textoperator g da ppmsg,1
sex ur mobile free sexy pic jordan text babe every wk get sexy celeb pocketbabecouk pic £wk,1
haha money leh later got go tuition haha looking empty slot driving lesson,0
ard lor,0
save money wedding lingerie wwwbridalpetticoatdreamscouk choose superb selection national delivery brought weddingfriend,1
still playing gautham,0
understand loss gain work school,0
stop club tone replying stop mix see mytonecomenjoy html term club tone cost gbpweek mfl po box mk wt,1
co darren say ü considering mah ask ü,0
asked sen come chennai search job,0
want lick pussy,0
long quit get like minute day,0
lol yep yesterday already got fireplace another icon sitting,0
haha yeah oz kind shitload,0
ur cashbalance currently pound maximize ur cashin send collect pmsg cc po box tcrw,1
aight thatll work thanks,0
ü still got lesson ü sch,0
hide anythiing keeping distance,0
sorry ill call later meeting thing related trade please call arul ltgt,0
hey r watching movie tonight ill prob b home early,0
opposite side dropped,0
got divorce lol shes,0
nice talking please dont forget pix want see,0
takin shower yeah ill leave im done,0
happy new year dear brother really miss got number decided send text wishing happiness abiola,0
aiyah wait lor u entertain hee,0
bloo bloo bloo ill miss first bowl,0
place ur point e culture module already,0
ur balance £ ur next question sang uptown girl answer txt ur answer good luck,1
lmao fun,0
current leading bid pause auction send customer care,1
free st week nokia tone ur mob every week txt nokia get txting tell ur mate zed pobox wwq normptone,1
hmmmstill dont opener,0
ok im coming home,0
hope thing went well doctor reminds still need godid u c little thing left lounge,0
well told others youd marry,0
awesome think get th usf time tonight,0
good evening roger,0
storming msg wen u lift phne u say hello u knw wt real meaning hello name girl yes u knw dat girl margaret hello girlfrnd f grahmbell invnted telphone moralone get name person bt girlfrnd g n g h,0
received understood n acted upon,0
place get room cheap,0
hey boy want hot xxx pic sent direct ur phone txt porn hr free p per day stop text stopbcm sf wcnxx,1
u dont know stubborn didnt even want go hospital kept telling mark im weak sucker hospital weak sucker,0
cant wait see photo useful,0
impossible argue always treat like sub like never released remind necessary,0
jay told already,0
todaysundaysunday holidayso work,0
stopped get ice cream go back,0
nice day dear,0
yup ok go home look timing msg ü xuhui going learn nd may lesson,0
thank callingforgot say happy onam sirjii fine remembered met insurance personmeet qatar insha allahrakhesh ex tata aig joined tisscotayseer,0
shall start hear,0
hoping get away langport still town tonight,0
fantasy football back tv go sky gamestar sky active play £k dream team scoring start saturday register nowsky opt,1
youre done mean,0
want send virtual hug need one,0
carry disturbing,0
night ended another day morning come special way may smile like sunny ray leaf worry blue blue bay gud mrng,0
derp worse dude always want party dude file complaint three drug abuser life,0
loan purpose £ £ homeowner tenant welcome previously refused still help call free text back help,1
good afternoon glorious anniversary day sweet j hope find happy content prey think send teasing kiss across sea coaxing image fond souveniers cougarpen,0
im home,0
slow using biolas fne,0
parent kidz friend n colleague screaming surprise waiting sofa naked,0
take small dose tablet fever,0
okmail dear dave final notice collect tenerife holiday cash award call landline tc sae box cwwx ppm,1
carlos say pick later yeah set,0
thats good let thank god please complete drug lot water beautiful day,0
sure driving reach destination soon,0
world happiest frnds never character dey best understanding difference,0
crazy ar he married ü like gd looking guy frens like say he korean leonas fave dun thk aft thinking mayb prob ill go,0
dont thnk wrong calling u,0
dunno da next show aft toa payoh got,0
lay man let know missed thought great day send bimbo ugos number ill appreciate safe,0
shore takin bus,0
lol would awesome payback,0
room,0
networking technical support associate,0
good morning princess,0
mum repent,0
alright omw got ta change order halfth,0
ok lor im town lei,0
going write ccna exam week,0
thanks ringtone order reference number x mobile charged tone arrive please call customer service colourredtextcolourtxtstar,1
guy car shop flirting got phone number paperwork called texted im nervous course may address call bos tell knowing may get fired,0
yup song bro creative neva test quality said check review online,0
sorry ill call later meeting,0
ceri u rebel sweet dreamz little buddy c ya moro need bloke,0
aight rush ill ask jay,0
waking afternoon sup,0
u knw dis ltgt,0
ill obey,0
think mentor percent sure,0
ok thk got u wan come wat,0
plan manage,0
cool like swimming pool jacuzzi house,0
urgent call landline complimentary tenerife holiday £ cash await collection sae tc box hp yf ppm,1
night ended another day morning come special way may smile like sunny ray leaf worry blue blue bay gud mrng,0
xmas new year eve ticket sale club day till pm thurs fri sat night week theyre selling fast,1
might come kerala daysso prepared take leave finalise dont plan travel visitneed finish urgent work,0
hi birth lb oz mother baby brilliantly,0
noi got rumour going buy apartment chennai,0
e timing go w u lor,0
private account statement show unredeemed bonus point claim call identifier code expires,1
wasnt well babe swollen gland throat end,0
well boy glad g wasted night applebees nothing,0
come din c ü yup cut hair,0
know pls open back,0
ku also dont msg reply msg,0
say slowly godi love amp need youclean heart bloodsend ten special people amp u c miracle tomorrow itplspls,0
ü got wat buy tell u ü need come,0
pls go ahead watt wanted sure great weekend abiola,0
good afternoon love go day hope maybe got lead job think boytoy send passionate kiss across sea,0
yo im right yo work,0
yetunde im sorry moji seem busy able go shopping please find way get wanted u get please forgive reply free via yahoo messenger,0
sm ac sptv new jersey devil detroit red wing play ice hockey correct incorrect end reply end sptv,1
u secret admirer reveal think u r special call opt reply reveal stop per msg recd cust care,1
dizzamn aight ill ask suitemates get back,0
say ltgt year old man money im last ltgt still waiting check,0
said matter mind saying matter,0
hi hope u r ok said would text hasnt u seen let gently please,0
im done c ü,0
sorry ill call later,0
dont let studying stress lr,0
fine remember,0
big difference ltgt versus ltgt every ltgt hr,0
howz person story,0
yes place town meet exciting adult single uk txt chat pmsg,1
night sweet sleep well ive see exorcism emily rose may never sleep hug snogs,0
guaranteed latest nokia phone gb ipod mp player £ prize txt word collect ibhltd ldnwh pmtmsgrcvd,1
excellent wish together right,0
big god bring success,0
x ltgt going get,0
look like u wil b getting headstart im leaving bout ish u r desperate company could head earlierwe goin meet rummer,0
private account statement show unredeemed point call identifier code expires,1
im da bus going home,0
id check there like bowl worth left,0
wat r u,0
midnight earliest,0
ok r meeting later,0
im home love still awake loving kiss,0
yup remb think book,0
keep ten r shelf buy two egg,0
£ xmas reward waiting computer randomly picked loyal mobile customer receive £ reward call,1
customer loyalty offerthe new nokia mobile £ txtauction txt word start get tctxt tc pmtmsg,1
aight tomorrow around ltgt,0
dear voucher holder next meal u use following link pc enjoy dining experiencehttpwwwvouchmecometlpdiningasp,1
parent kidz friend n colleague screaming surprise waiting sofa naked,0
guy close,0
maybe woke fucking wouldnt problem,0
urgent costa del sol holiday £ await collection call toclaim sae tc pobox stockport skxh cost£pm maxmins,1
thank baby cant wait taste real thing,0
happen dear silent tensed,0
shit really shocking scary cant imagine second def night u think somewhere could crash night save taxi,0
didnt get hep b immunisation nigeria,0
good day,0
good time nice something bit different weekend change see ya soon,0
still tonight,0
dunno let go learn pilate,0
great shoot big load get ready,0
well officially philosophical hole u wan na call home ready saved,0
dont run away frm u walk slowly amp kill u dont care enough stop,0
whats happening gotten job begun registration permanent residency,0
hmmm thought said hour slave late punish,0
sorry going home first daddy come fetch ü later,0
really hope work doesnt get stressful gr day,0
hmm ok ill stay like hour co eye really sore,0
hey time driving fri go evaluation fri,0
depends quality want type sent boye faded glory want ralphs maybe,0
k want u come,0
eastenders tv quiz flower dot compare violet e tulip f lily txt e f chance win £ cash wkentp,1
book lesson msg call work sth im going get spec membership px,0
plz tell an bslvyl sent via fullonsmscom,0
contacted dating service someone know find call mobile landline poboxldns,1
wont anything de,0
let go bill miller,0
ive reached home n bathe liao u call,0
yet id like keep touch easiest way barcelona way ru house,0
urgent mobile awarded £ bonus caller prize nd attempt contact call boxqu,1
busy trying finish new year looking forward finally meeting,0
r giving second chance rahul dengra,0
hello boytoy geeee miss already woke wish bed cuddling love,0
making dinner,0
ill see prolly yeah,0
im list buyer,0
quite ok bit ex u better go eat smth else ill feel guilty,0
call germany penny per minute call fixed line via access number prepayment direct access wwwtelediscountcouk,1
free st week nokia tone ur mob every week txt nokia get txting tell ur mate wwwgetzedcouk pobox w wq norm ptone,1
cab availablethey pick drop door step,0
alright took morphine back yo,0
mom want know,0
dont want hear philosophy say happen,0
ki deleted contact,0
check choose babe video smsshsexnetun fgkslpopw fgkslpo,1
pls speak wont ask anything friendship,0
think ive fixed send test message,0
supposed meet discus abt trip thought xuhui told afternoon thought go lesson,0
took hooch walk toaday fell splat grazed knee everything stayed home see tomorrow,0
thank much selflessness love plenty,0
sure stomach,0
know im lacking particular dramastorms detail part im worried,0
macha dont feel upseti assume mindsetbelieve one evening wonderful plan uslet life begin againcall anytime,0
bad girl still remember,0
din tell u jus,0
huh got lesson lei n thinkin going sch earlier n tot parkin kent vale,0
good night dear sleepwellamptake care,0
actual exam harder nbme,0
cool let know kick around ltgt ill day,0
dear free message without recharge hi hi hi,0
bishan lar nearer need buy early co buy got ta park car,0
lol yes add spice day,0
okay lor still let u go ah coz know later drop card box right,0
thanks loving rock,0
ur face test ltgt select number tell ur face astrology waiting quick reply,0
gumbys special ltgt cheese pizza know doin tonight,0
u dun say early hor u c already say,0
dont know come ask question like dont mistake,0
done handed celebration full swing yet,0
mum went dentist,0
wat make u thk ill fall actually thk im quite prone fall lucky dad home ask come n fetch already,0
dont know u u dont know send chat let find pmsg rcvd hgsuitelandsrowwjhl ldn year,1
sound good keep posted,0
good evening sir hope nice day wanted bring notice late paying rent past month pay ltgt charge felt would inconsiderate nag something give great cost thats didnt speak however recession wont able pay charge month hence askin well ahead month end please help thank everything,0
nah dub je still buff,0
spoon okay,0
‘ going try month ha ha joking,0
thank princess want see nice juicy booty,0
lost pound help,1
urgent call landline complimentary ibiza holiday £ cash await collection sae tc po box sk wp ppm,1
hope ur head doesnt hurt much ploughing way pile ironing staying chinky tonight come round like,0
congratulation ur awarded cd voucher gift guaranteed free entry wkly draw txt music tncs wwwldewcomwinppmxage,1
like spoiled,0
jolly good way give u ticket sat eve speak x,0
hurt tease make cry end life die plz keep one rose grave say stupid miss u nice day bslvyl,0
good afternoon starshine hows boytoy crave yet ache fuck sip cappuccino miss babe teasing kiss,0
yup izzit still raining heavily co im e mrt cant c outside,0
goodmorning today late ltdecimalgt min,0
bored housewife chat n date btnational rate pmin landline,1
ok asked money far,0
happen dear tell,0
didnt mean post wrote like many time ive ritten stuff let sit feeling time angry left hit send stop wasnt checked phone got car wasnt said didnt sleep bored wouldnt time clean fold laundry etc least make bed,0
yup thk r e teacher said make face look longer darren ask cut short,0
free st week nokia tone ur mob every week txt nokia get txting tell ur mate wwwgetzedcouk pobox wwq normptone,1
nothing got msg frm tht unknown,0
ive called hoping lr malaria know miss guy miss ban big pls give love especially great day,0
hey want anything buy,0
oh icic k lor den meet day,0
hey babe friend cancel still visit,0
two carton u pleased shelf,0
ok prob,0
üll submitting da project tmr rite,0
yar lor keep raining non stop u wan go elsewhere,0
promise take good care princess run please send pic get chance ttyl,0
sorry ill call later,0
ü go buy wif meet ü later,0
hamster dead hey tmr meet pm orchard mrt,0
im turning phone mom telling everyone cancer sister wont stop calling hurt talk cant put see u u get home love u,0
download many ringtones u like restriction choose u even send yr buddy txt sir £,1
important information orange user xxxxxxx today lucky dayfind log onto httpwwwurawinnercom there fantastic surprise awaiting,1
lol always convincing,0
happened yo date,0
huh cant go ur house empty handed right,0
wish great semester,0
panasonic bluetoothhdset free nokia free motorola free doublemins doubletxt orange contract call mobileupd call optout,1
urgent mobile awarded £ bonus caller prize nd attempt contact call boxqu bt national rate,1
well im glad didnt find totally disagreeable lol,0
yeah ill leave couple minute amp let know get mu,0
made eta taunton planned hope ‘ still okday good see xx,0
pls help tell sura im expecting battery hont pls send message download movie thanks,0
happy new year melody,0
call germany penny per minute call fixed line via access number prepayment direct access,1
freemsg hey im buffy love satisfy men home alone feeling randy reply c pix qlynnbv helpp msg send stop stop txts,1
open door,0
mum say wan go go shun bian watch da glass exhibition,0
well meant opposed drunken night,0
hoping would send message rent due dont enough reserve completely gone loan need hoping could balance ltgt way could get till mid march hope pay back,0
roger ‘ probably going rem,0
ur chance win £ cash every wk txt play tscs wwwmusictrivianet custcare xpwk,1
urgent please call landline £ cash holiday await collection c sae po box mxy,1
noe ü specify da domain nusstu ü still sch,0
speak feel word better silence gud mrng,0
dropped em omw back,0
bill £ thats bad,0
ltgt w jetton ave forgot,0
laptop noe infra slow lar wan fast one,0
okie,0
poking man everyday teach canada abi saying hi,0
late,0
free tone hope enjoyed new content text stop unsubscribe helpp provided tonesyoucouk,1
yeah got list u joanna im feeling really anti social,0
glad went well come well plenty time claire go work,0
dont search love let love find u thats called falling love bcoz u dont force u fall u know smeone hold u bslvyl,0
u noe wat time e place dat sell close,0
finished class,0
beautiful truth gravity read carefully heart feel light someone feel heavy someone leaf goodmorning,0
