message,label
hey chief give bell get need talk royal visit st june,0
yoyyooo u know change permission drive mac usb flash drive,0
anyone call treadmill say youll buy make sure working found ad craigslist selling ltgt,0
ambrithmaduraimet u arun dha marrgeremembr,0
aight call youre close,0
sound gd haha wah u yan jiu fast liao,0
friend u stay fb chat,0
k need login anything,0
text get dont call phone problem,0
sure night menu know noon menu,0
urgent please call abta complimentary spanish holiday £ cash await collection sae tc box po ez ppm,1
want sent ltgt mesages today thats sorry hurt,0
poor girl cant go one day lmao,0
u really pig leh sleep much dad wake smth eat lunch today,0
call freephone,1
sweet may may go u meet carlos gauge patty interest,0
kaiez enjoy ur tuition gee thk e second option sound beta ill go yan jiu den msg u,0
blanket sufficient thx,0
bugis juz wat im walking home oredi ü late reply oso saw top dat like din buy r ü,0
single line big meaning miss anything ur best life dont miss ur best life anything gud nyt,0
find way didnt include detail,0
ill late,0
thankyou much call appreciate care,0
gud mrng dear hav nice day,0
free message activate free text message replying message word free term condition visit wwwcom,1
cutest girl world,0
tell need investigate anywhere,0
long since screamed princess,0
hhahhaahahah rofl wtf nig leonardo room something,0
use foreign stamp whatever send,0
feel always happy slowly becomes habit amp finally becomes part life follow happy morning amp happy day,0
contacted dating service someone know find call land line poboxwtgp,1
sign maturity start saying big thing actually start understanding small thing nice evening bslvyl,0
leave wif lar ü wan carry meh heavy da num familiar ü,0
congratulation ore mo owo wa enjoy wish many happy moment fro wherever go,0
always celebrate ny family,0
japanese proverb one u none itu must indian version one let none itleave finally kerala version one stop none make strike,0
tried call reply sm video mobile min unlimited text free camcorder reply call del thurs,1
oh ya got hip hop open haha thinking go jazz zoom cine actually tonight im free leh there kb lesson tonight,0
shuhui say change suntec steamboat u noe r u,0
urgent week free membership £ prize jackpot txt word claim tc wwwdbuknet lccltd pobox ldnwarw,1
exhausted train morning much wine pie sleep well,0
‘ reassuring crazy world,0
wait ü inside da car park,0
brainless baby dolld vehicle sariyag drive madoke barolla,0
u r much close heart u go away shattered plz stay,0
gas station like block away house youll drive right since armenia end swann take howard,0
hurry ive weeddeficient like three day,0
k u bored come home,0
great safe trip dont panic surrender,0
cant pick phone right pls send message,0
winner valued network customer selected receivea £ prize reward claim call claim code kl valid hour,1
ok msg u b leave house,0
ok good later come find ü c lucky told ü go earlier later pple take finish ü,0
yeh def something satjust got payedday havbeen given a£ pay rise work havebeen made preschoolcoordinator feelingood luv,0
yay better told girl either,0
shoot big load get ready,0
ok thanx take care,0
im leaving house,0
hi im always online yahoo would like chat someday,0
u make fb list,0
oh yeahand hav great time newquaysend postcard look girl im goneu know im talkin boutxx,0
send id password,0
still checked da,0
gud ni dearslp welltake careswt dreamsmuah,0
wanted ask ü wait finish lect co lect finish hour anyway,0
free st week entry textpod chance win gb ipod £ cash every wk txt vpod tscs wwwtextpodnet custcare,1
know account detailsi ask mom send youmy mom reach,0
dear going rubber place,0
people game im mall iouri kaila,0
yes im small kid boost secret energy,0
kkhow business,0
thanx puttin da fone,0
cool text youre ready,0
see cup coffee animation,0
camera awarded sipix digital camera call fromm landline delivery within day,1
big brother ‘ really scraped barrel shower social misfit,0
well watch shrek db,0
ok anybody asks abt u tel themp,0
ok careful dont text drive,0
yeah ‘ stand close tho ‘ catch something,0
doesnt make sense take unless free need know wikipediacom,0
dear subscriber ur draw £ gift voucher b entered receipt correct an elvis presley birthday txt answer,1
hmmm thk sure got time hop ard ya go free abt muz call u discus liao,0
people see msg think iam addicted msging wrong bcoz dont know iam addicted sweet friend bslvyl,0
record indicate u maybe entitled pound compensation accident claim free reply claim msg stop txt stop,1
always make thing bigger,0
january male sale hot gay chat cheaper call national rate pmin cheap pmin peak stop text call pmin,1
r u sam p eachother meet go house,0
hey happened u switch ur cell whole day isnt good u care give call tomorrow,0
yeah basically time next week get away mom amp get,0
eerie nokia tone u rply tone title eg tone dracula title ghost addamsfa munsters exorcist twilight wwwgetzedcouk poboxwwq p,1
ha ha nan yalrigu heltiniiyo kothi chikku u shared many thing wit meso far didnt told body even uttered word abt u ur trusting much tell others plz nxt time dont use word meok chikkub,0
free st week nokia tone ur mob every week txt nokia get txting tell ur mate wwwgetzedcouk pobox wwq normptone,1
sending greeting joy happiness gr evening,0
tddnewsletteremccouk game thedailydraw dear helen dozen free game great prizeswith,1
probably gon na swing wee bit,0
sweet heart,0
cheer callin babesozi culdnt talkbut wannatell u detail later wenwecan chat properly x,0
wifehow knew time murder exactly,0
call use ur min call cast pmin mob vary service provided aom gbpmonth aom boxm er u stop age,1
hi kate lovely see tonight ill phone tomorrow got sing guy gave card xxx,0
ü v fan,0
pathaya enketa maraikara pa,0
sorryin meeting ill call later,0
cant keep talking people sure pay agree price pls tell want really buy much willing pay,0
today offer claim ur £ worth discount voucher text yes savamob member offer mobile c £ sub unsub reply x,1
fyi im gon na call sporadically starting like ltgt bc doin shit,0
oh grand bit party doesnt mention cover charge probably first come first served,0
sorry ill call later,0
true passable get high score apply phd get year salary make life easier,0
good morning im suffering fever dysentry able come office today,0
okie thanx,0
kkwhen give treat,0
wait thats still clear sure sarcastic thats x doesnt want live u,0
started dont stop pray good idea anything see help guy ill forward link,0
please call immediately urgent message waiting,1
life style garment account please,0
hello beautiful r u ok ive kinda ad row wiv walked pub wanted night wiv u miss u,0
come right ahmad,0
lolnice went fish water,0
said right giggle saw u would possibly first persondie nvq think much could,0
today im workin free oso gee thgt u workin ur frens shop,0
yeah get random dude need change info sheet party ltgt never study safe,0
knowyetunde hasnt sent money yet sent text bother sending dont involve anything shouldnt imposed anything first place apologise,0
therell minor shindig place later tonight interested,0
sure get acknowledgement astoundingly tactless generally faggy demand blood oath fo,0
surfing online store offer want buy thing,0
cool breeze bright sun fresh flower twittering bird waiting wish u goodmorning amp nice day,0
symptom u love u like listening song u get stopped u see name beloved u wont get angry,0
ok would b lovely u r sure think wot u want drinkin dancin eatin cinema u wot,0
good morning dear shijutta great amp successful day,0
slept timeyou,0
u early,0
well done luv ya,0
bored speed dating try speedchat txt speedchat dont like em txt swap get new chatter chat poboxwwq pmsg rcd,1
ranjith cal drpd deeraj deepak min hold,0
hows ur paper,0
dude ive seeing lotta corvette lately,0
nothing meant money enters account bank remove flat rate someone transfered ltgt account ltgt dollar got removed bank differ charge also differbe sure trust ja person sending account detail co,0
twenty past five said train durham already coz reserved seat,0
well keep mind ive got enough gas one round trip barring sudden influx cash,0
hiya last night ive naughty bought clothes little ready shopping tho kind time wan na meet,0
he really skateboarding despite fact get thrown wind bandage shit arm every five minute,0
sir waiting letter,0
princess,0
want funk ur fone weekly new tone reply tonesu text wwwringtonescouk original n best tone gbp network operator rate apply,1
yes completely formclark also utter waste,0
thanks message really appreciate sacrifice im sure process direct pay find way back test tomorrow im class wonderful day,0
life never much fun great came made truly special wont forget enjoy one gbpsms,1
hi u want join sts later meeting five call u class,0
urgent mobile £ bonus caller prize nd attempt reach call asap boxnqp ppm,1
awesome lem know whenever youre around,0
im good thinking,0
hidid asked waheeda fathima leave,0
messageno responcewhat happend,0
cheer message zogtorius ive staring phone age deciding whether text,0
im really still tonight babe,0
sorry ill call later,0
happy new year u,0
people dogging area call join like minded guy arrange there evening a£ minapn lsbb,1
oz guy kinda flaky one friend interested picking ltgt worth tonight possible,0
lara said loan ltgt,0
bu voucher wc marsms log onto wwwbutelecom discount credit opt reply stop customer care call,1
one teach ship car,0
ok,0
much payed suganya,0
dont understand message,0
credit topped httpwwwbubbletextcom renewal pin tgxxrz,1
new textbuddy chat horny guy ur area p free receive search postcode gaytextbuddycom txt one name rpl stop cnl,1
u havent lost ill always b ui didnt intend hurt u never knew u felt iwasmarinethats itriedtell urmomi careabout u,0
ok im gon na head usf like fifteen minute,0
yes finished watching day life love,0
ohas usual vijay film different,0
time come tomorrow,0
shall fine avalarr hollalater,0
could work well reach consensus next meeting,0
let make saturday monday per convenience,0
reached home tired come tomorro,0
ok problem yup im going sch rem correctly,0
ya nice ready thursday,0
kyou girl waiting reception ah,0
ah well confuses thing ‘,0
taka lor wat time u wan come n look u,0
got lot hair dresser fr china,0
k ill,0
k wat tht incident,0
information ikea spelled cap yelling thought left sitting bed among mess came said going got home class please dont try bullshit make want listen le,0
hiya u paying money account thanks got pleasant surprise checked balance u c dont get statement acc,0
dont anybodys number still havent thought tactful way ask alex,0
yup already thanx printing n handing,0
oh send address,0
ok april cant wait,0
ah poop look like ill prob send laptop get fixed cuz gpu problem,0
ü neva tell noe im home da aft wat,0
heard u call rude chat private line cum wan c pic gettin shagged text pix end send stop sam xxx,1
sorry ill call later,0
urgh coach hot smell chip fat thanks especially duvet predictive text word,0
mobile numberpls sm ur mail idconvey regard achanammarakheshqatar,0
hi babe thanks coming even though didnt go welli wanted bed hope see soon love kiss xxx,0
win £ shopping spree every week starting play text store skilgme tscs winawk age £perweeksub,1
sad story man last week bday wife didnt wish parent forgot n kid went work even colleague wish entered cabin pa said happy bday bos felt special askd lunch lunch invited apartment went said u mind go bedroom minute ok sed sexy mood came minuts latr wid caken wife parent kidz friend n colleague screaming surprise waiting sofa naked,0
ok lor u wan go look u,0
ok prob ill come lunch,0
kind missed train co asthma attack nxt one half hr driving sure park,0
thanks yesterday sir wonderful hope enjoyed burial mojibiola,0
yo dude guess got arrested day,0
kkwhat detail want transferacc enough,0
wanted wish happy new year wanted talk legal advice gary split person ill make trip ptbo hope everything good babe love ya,0
rajipls favour pls convey birthday wish nimya pls today birthday,0
cant speak bcaz mobile problem listen cannt listen voice call later,0
want get laid tonight want real dogging location sent direct ur mob join uk largest dogging network bt txting gravel nt eca pmsgp,1
yeah thats impression got,0
eastenders tv quiz flower dot compare violet e tulip f lily txt e f chance win £ cash wkentp,1
yeah wheres class,0
sorry got late start way,0
… anyway many good evening u,0
aight text youre back mu ill swing need somebody get door,0
ltgt thats guess thats easy enough,0
message sent askin ltgt dollar shoul pay ltgt ltgt,0
wats da decision,0
joining today formallypls keep prayingwill talk later,0
new club dont fink met yet b gr c u please leave msg day wiv ur area reply promised carlie x calls£minmobsmore lkpoboxhpfl,1
pls tell nelson bb longer comin money expecting aint coming,0
okey dokey swashbuckling stuff oh,0
ü come,0
yes know cheesy song frosty snowman,0
thank princess sexy,0
ive reached sch already,0
one talking,0
good sleep rhythm person establish rhythm body learn use want know,0
aight sound good want come,0
ok,0
samus shoulder yet,0
finished work yet something,0
hey come online use msn,0
like hotel dusk game think solve puzzle area thing,0
ducking chinchilla,0
nice day impressively sensible went home early feel fine boring whens cant remember,0
mean left early check co im working,0
nothin come mind ü help buy hanger lor ur laptop heavy,0
fine thanks,0
mmmm cant wait lick,0
omg joanna freaking shes looked thru friend find photo shes asking stuff myspace havent even logged like year,0
ive trying reach without success,0
ok,0
sorry dai thought calling lot timeslil busyi call noon,0
yeah work fine started last week stuff dull easy guy fun,0
yeah got v apologetic n fallen actin like spoilt child got caught till wont go badly cheer,0
nokia phone lovly,0
ok lor wat time ü finish,0
he apparently bffs carly quick,0
guaranteed latest nokia phone gb ipod mp player £ prize txt wordcollect tcllc nyusa pmt msgrcvd,1
im late tellmiss im way,0
mm asked call radio,0
hi probably much fun get message thought id txt u co im bored james farting night,0
de asking like,0
bought one ringtone getting text costing pound offering tone etc,1
great im church holla get,0
good morning princess,0
ic lol play door sometime yo,0
cancelled yeah baby well sound important understand darlin give ring later fone love kate x,0
nojst change tat,0
nah man car meant crammed full people,0
heard u call night knickers make beg like u last time xx luv nikiyunet,1
dare ask luck sorting car,0
true lov n care wil nevr go unrecognized though somone often make mistake valuing definitly undrstnd start missing,0
call senthil hsbc,0
ive reached already,0
love daddy make scream pleasure going slap as dick,0
sorry dude dont know forgot even dan reminded sorry hope guy fun,0
new local date area lot new people registered area reply date start wwwflirtpartyus reply,1
oops ltgt,0
lasting much hour might get lucky,0
text meet someone sexy today u find date even flirt u join p reply name age eg sam msg recdthirtyeight penny,1
sad story man last week bday wife didnt wish parent forgot n kid went work even colleague wish entered cabin pa said happy bday bos felt special askd lunch lunch invited apartment went said u mind go bedroom minute ok sed sexy mood came minuts latr wid caken wife parent kidz friend n colleague screaming surprise waiting sofa naked,0
r u yet im wearing blue shirt n black pant,0
get dump heap mom decided come lowes boring,0
never blame day ur life good day give u happiness bad day give u experience essential life god blessing good morning,0
oh ho first time u use type word,0
thnx dude u guy nite,0
wud never mind u dont miss u dont need u wil really hurt wen u need amp u dont tell take care,0
id like tell deepest darkest fantasy call pmin stop text call nat rate,1
dunno lei might b eatin wif frens ü wan eat wait ü lar,0
edison rightly said fool ask question wise man answer know u speechless viva gmgngegnt,0
congrats year special cinema pas call c suprman v matrix starwars etc free bxipwe pm dont miss,1
ü write wat,0
guess could good excuse lol,0
probably im almost gas get cash tomorrow,0
want new video phone anytime network min half price line rental free text month reply call free delivery,1
cbe chennai,0
natalie f inviting friend reply yes see wwwsmsacunataliek stop send stop frnd,1
anetworks allow company bill sm responsible supplier shop give guarantee sell b g,1
sea lay rock rock envelope envelope paper paper word,0
u wana see,0
still looking job much ta earn,0
aiyo co sm ü ü neva reply wait ü reply lar tot ü havent finish ur lab wat,0
ew one,0
hey late im amk need drink tea coffee,0
said would woke,0
yup,0
yo watching movie netflix,0
pls need dat slowly vomit,0
good evening,0
gosh pain spose better come,0
dont make life stressfull always find time laugh may add year life surely add life ur year gud niswt dream,0
want go perumbavoor,0
dont send plus hows mode,0
let pool money together buy bunch lotto ticket win get ltgt u get ltgt deal,0
dont know support as srt thnk think p play usb,0
thanks chikku gud nyt,0
interflora its late order interflora flower christmas call place order midnight tomorrow,1
never try alone take weight tear come ur heart fall ur eye always remember stupid friend share bslvyl,0
yup ive finished c ü,0
still havent collected dough pls let know go place sent get control number,0
,0
hi harishs rent transfred ur acnt,0
bluray player,0
free entry wkly comp win fa cup final tkts st may text fa receive entry questionstd txt ratetcs apply over,1
ive told ive returned order,0
oh gei happend tron maybe ill dl,0
liked new house,0
geeee miss already know think fuck cant wait till next year together loving kiss,0
waiting call sir,0
hmm ill think ok youre forgiven,0
free unlimited hardcore porn direct mobile txt porn get free access hr chrgdp per day txt stop exit msg free,1
ever easier,0
infact happy new year seeing,0
wen ur lovable bcums angry wid u dnt take seriously coz angry childish n true way showing deep affection care n luv kettoda manda nice day da,0
omg want scream weighed lost weight woohoo,0
want new nokia colour phone delivered tomorrow free minute mobile free text free camcorder reply call,1
lookatme thanks purchase video clip lookatme youve charged p think better send video mmsto,1
housemaid murderer coz man murdered ltgt th january public holiday govtinstituitions closedincluding post officeunderstand,0
hey booked kb sat already lesson going ah keep sat night free need meet confirm lodging,0
tell quite long co havent finish film yet,0
keep ur problem ur heart bcoz nobody fight u u amp u fight ur self amp win battle vivekanand g sd,0
missed call cause yelling scrappy miss u cant wait u come home im lonely today,0
merry christmas babe love ya kiss,0
wana plan trip sometme,0
love give massage use lot baby oil fave position,0
sfine anytime best,0
could read love answered,0
company goodenvironment terrific food really nice,0
like made throw smoking friend car one time awesome,0
ok noe ure busy im really bored msg u oso dunno wat colour choose one,0
brother transfered ltgt ltgt pa,0
anything,0
im boat still mom check yo im half naked,0
im home please call,0
vote wherever heart guide,0
noe la u wana pei bf oso rite k lor day den,0
u still havent got urself jacket ah,0
im saying havent explicitly told nora know someone im probably gon na bother,0
dont know shes getting message,0
sir waiting mail,0
k yan jiu liao sat go bugis vill one frm den hop parco nb sun go cine frm den hop orc mrt hip hop,0
remind hr,0
im driving raining ill get caught e mrt station lor,0
xy trying smth u eat already havent,0
valuable affectionate loveable eternal noble truthful intimate natural enamous happy valentine day advance,0
please call customer service representative ampm guaranteed £ cash £ prize,1
new message please call,1
take like noon,0
right wasnt phoned someone number like,0
bought test yesterday something let know exact day u ovulatewhen get u wks pls pls dont fret know u r worried pls relax also anything ur past history u need tell,0
please da call mistake side sorry da pls da goto doctor,0
hello going village pub either come accordingly ok,0
aiyo u always c ex one dunno abt mei reply first time u reply fast lucky workin huh got bao ur sugardad ahgee,0
there someone year ltgt toyota camry like mr olayiwolas mileage ltgt kit clean need know much sell raise dough soon landing sell holla back,0
yo yo yo byatch whassup,0
wat r u,0
ha u jus ate honey ar sweet,0
valentine day special win £ quiz take partner trip lifetime send go pmsg rcvd custcare,1
urgent nd attempt contact uu £call b tcsbcmwcnxxcallcostppmmobilesvary max£,1
mmmmmm love youso much ahmad cant wait year begin every second take closer side happy new year love,0
tuition hm go one mind,0
usualiam fine happy amp well,0
daily text – favour time,0
awww dat sweet think something nice time tonight ill probably txt u later co im lonely xxx,0
drop tank,0
stitch trouser,0
sorry cant help,0
ok thanx gd nite ü,0
well imma definitely need restock thanksgiving ill let know im,0
sorry ill call later,0
cant pick phone right pls send message,0
sad story man last week bday wife didnt wish parent forgot n kid went work even colleague wish,0
weightloss girl friend make load money ebay something give thanks god,0
whats feathery bowa something guy dont know,0
hi darlin hope nice night wish come cant wait see love fran p want dirty anal sex want man gang bang,0
haha awesome minute,0
dear uve invited xchat final attempt contact u txt chat,1
want ltgt r dado,0
im work please call,0
u wake already wat u u picking u later rite im taking sq reaching ard smth like dat u check e arrival time c ya soon,0
da good good playerwhy unsold,0
ok ksry knw sivatats askd,0
dont show far put new picture facebook,0
home lei,0
somebody set website play hold em using eve online spacebucks,0
ü ask dad pick ü lar ü wan stay meh,0
mystery solved opened email he sent another batch isnt sweetie,0
mah b ill pick tomorrow,0
thank winner notified sm good luck future marketing reply stop customer service,1
guy planning coming,0
excellent spent ltgt year air force iraq afghanistan stable honest like traveling,0
tired havent slept well past night,0
im going bath msg next ltgt min,0
mean come chase stated watch many movie want,0
yetunde im class run water make ok pls,0
chance reality fantasy show call p per min ntt ltd po box croydon cr wb national rate call,1
mathews tait edward anderson,0
aight lem know whats,0
friendship game play word say doesnt start march end may tomorrow yesterday today e,0
make girl happy difficult make girl happy u need friend companion lover chef ltgt good listener ltgt organizer ltgt good boyfriend ltgt clean ltgt sympathetic ltgt athletic ltgt warm ltgt courageous ltgt determined ltgt true ltgt dependable ltgt intelligent ltgt psychologist ltgt pest exterminator ltgt psychiatrist ltgt healer ltgt stylist ltgt driver aaniye pudunga venaam,0
plz tell an bslvyl sent via fullonsmscom,0
surly ill give coming review,0
ok come ur home half hour,0
jay snickering tell x totally fucking chord speak,0
please call customer service representative freephone ampm guaranteed £ cash £ prize,1
yet chikkuwat abt u,0
wheres mummy boy good bad positive negative mummy made wait hmmmm,0
laid airtel line rest,0
wat r u busy wif work,0
oh u must taken real valentine shopping first,0
meant say cant wait see u getting bored bridgwater banter,0
tick tick tick babe,0
aiyo bit pai seh ü noe scared dun rem die hee become better lookin oredi leh,0
okie,0
ok,0
madamregret disturbancemight receive reference check dlf premaricakindly informedrgdsrakheshkerala,0
nokia tone ur mob every week txt nok st tone free get txtin tell ur friend ptone reply hl info,1
yeah probs last night obviously catching speak soon,0
happy birthday youdearwith lot loverakhesh nri,0
urgent ur £ guaranteed award still unclaimed call closingdate claimcode mm £pmmorefrommobilebremovedmobypoboxlsyf,1
going sao mu today done,0
urgent mobile number awarded ukp prize guaranteed call landline claim valid hr ppm,1
oh thats late well good night give u call tomorrow iam going go sleep night night,0
u sure u cant take sick time,0
arr birthday today wish get oscar,0
wonder phone battery went dead tell love babe,0
aight ill hit get cash,0
want talk,0
eh den sat u book e kb liao huh,0
havent heard anything he answering text im guessing flaked said jb fantastic,0
yeah probably,0
£ winner guaranteed caller prize final attempt contact claim call ppmpoboxbhambxe,1
going college pa else ill come self pa,0
private account statement show unredeemed point call identifier code expires,1
dont cancer mom making big deal regular checkup aka pap smear,0
good night going sleep,0
nt joking seriously told,0
feb ltgt love u day send dis ur valued frnds evn come back ull gt married person u luv u ignore dis u lose ur luv evr,0
im home please call,0
said ü dun haf passport smth like dat ü juz send email account,0
apps class varaya elaya,0
ok lor,0
av new number wil u use oneta,0
new theory argument win situation loses person dont argue ur friend kick amp say im always correct,0
sif one good partnership going take lead,0
tunji hows queen wishing great day abiola,0
likely called mittelschmertz google dont paracetamol dont worry go,0
speaking cash yet,0
actually decided hungry havent left yet v,0
kkhow training process,0
k sent,0
