message,label
happy valentine day know early hundred handsomes beauty wish thought finish aunty uncle st,0
u got person story,0
see thought,0
wishing beautiful day moment revealing even thing keep smiling enjoy,0
watching tv lor nice one like lor,0
oops ill let know roommate done,0
well little time thing good time ahead,0
u laugh really loud u talk spontaneously u dont care others feel u probably dear amp best friend goodevening dear,0
tried contact reply offer video handset anytime network min unlimited text camcorder reply call,1
forgot ask ü smth there card da present lei ü want write smth sign,0
boo im way mom shes making tortilla soup yummmm,0
wat r u,0
hey whats charles sorry late reply,0
hahahause brain dear,0
moji love word rich day,0
ringtoneking,1
wewa iriver mb,0
xmas story peace xmas msg love xmas miracle jesus hav blessed month ahead amp wish u merry xmas,0
dawhats plan,0
new message please call,1
big brother alert computer selected u k cash voucher call ntt po box cro bt landline cost ppm mobile vary,1
rodger burn msg tried call reply sm free nokia mobile free camcorder please call delivery tomorrow,1
came hostel,0
neshanthtel r u,0
spjanuary male sale hot gay chat cheaper call national rate pmin cheap pmin peak stop text call pmin,1
many time lose best one bcoz,0
yeshere tv always available work place,0
sorry took long omw,0
come mahal bus stop ltdecimalgt,0
kkgoodstudy well,0
purchase stuff today mail po box number,0
mean u could keep ur word,0
many happy return day wish happy birthday,0
wan win meetgreet westlife u currently tour unbreakable untamed unkempt text cost p std text,1
mag meeting avo point,0
u outbid simonwatson shinco dvd plyr bid visit sm acsmsrewards end bid notification reply end,1
get,0
good morning dear great amp successful day,0
india take lead,0
ugh hopefully asus ppl dont randomly reformat,0
ill ltgt ok,0
convey regard,0
want inside every night,0
urgent nd attempt contact u £ prize yesterday still awaiting collection claim call,1
said text one time,0
yup next stop,0
got meh,0
v nice sheffield tom air opinion category b used measure ethnicity next census busy transcribing,0
miss ya need ya want ya love ya,0
valentine day special win £ quiz take partner trip lifetime send go pmsg rcvd custcare,1
see letter b car,0
remind get shall,0
hi hope u get txtjourney hasnt gdnow min late think,0
many people seems special first sight remain special till last sight maintain till life end shjas,0
okie,0
yup ü comin,0
buy blackberry bold torch buy new used let know plus saying buy ltgt g wifi ipad saying ltgt g,0
yup anything lor u dun wan ok,0
yes started send request make pain came back im back bed double coin factory got ta cash nitros,0
well im computerless time make oreo truffle,0
thk ü got ta go home urself co ill b going shopping frens present,0
someone smoke every time ive smoked last two week calling texting wanted smoke,0
mark work tomorrow get work house meet u afterwards,0
nonenowhere ikno doesdiscountshitinnit,0
guessin aint gon na,0
hey babe u doin wot u nite love annie x,0
say somebody named tampa,0
missionary hook doggy hook standing,0
lol ok didnt remember til last nite,0
want finally lunch today,0
hey sexy bun day word morning ym think,0
got called tool,0
frnd juz wordnot merely relationshipits silent promise say wherevr whenevr forevr gudnyt dear,0
yeah imagine would really gentle unlike doc treat patient like turkey,0
tried contact response offer new nokia fone camcorder hit reply call delivery,1
tot u outside co darren say u come shopping course nice wat jus went sim lim look mp player,0
want see pretty pussy,0
wow didnt think common take back ur freak unless u chop,0
someone contacted dating service entered phone becausethey fancy find call landline pobox wrg p,1
planning come chennai,0
height oh shit situation guy throw luv letter gal fall brother head who gayd,0
come get b quite diff guess rite,0
sad story man last week bday wife didnt wish parent forgot n kid went work even colleague wish,0
thats significant dont worry,0
didnt spring coming early yay,0
u going ikea str aft dat,0
new car house parentsi new job hand,0
dont use hook,0
baby promise treat well bet take good care,0
huh also many mistake,0
smile pleasure smile pain smile trouble pours like rain smile sum hurt u smile becoz someone still love see u smiling,0
cant make tonight,0
jus telling u dat ill b leaving shanghai st instead well haf time meet cya,0
dnt wnt tlk wid u,0
started searching get job dayshe great potential talent,0
hi lucy hubby meetins day fri b alone hotel u fancy cumin pls leave msg day lucy x calls£minmobsmorelkpoboxhpfl,1
hard believe thing like say lie think twice saying anything,0
heart empty without love mind empty without wisdom eye r empty without dream amp life empty without frnds alwys touch good night amp sweet dream,0
came look flat seems ok away alot wiv work got woman coming,0
hi dear saw dear happy battery low,0
come life brought sun shiny warming heart putting constant smile face making feel loved cared,0
please reserve ticket saturday eve chennai thirunelvali tirunelvali chennai sunday evei already see netno ticket availablei want book ticket tackle,0
hottest pic straight phone see getting wet wanting xx text pic txt cost p textoperator gga xxx,1
umma say anything,0
stop calling everyone saying might cancer throat hurt talk cant answering everyones call get one call im babysitting monday,0
come slave going shell unconsciously avoiding making unhappy,0
tirupur call da,0
bring tat cd forget,0
u dun wan u dun like already ah wat u still eating,0
lost kilo today,0
taking part mobile survey yesterday text use however wish get txts send txt tc wwwtxtcom p,1
k jason say he gon na around ill around ltgt,0
yeah go bored depressed sittin waitin phone ring hope wind drop though scary,0
hi babe uawakefeellikw shitjustfound via aletter thatmum gotmarried thnovbehind ourbacks  fuckinniceselfishdeviousbitchanywayil call u,0
got call landline number asked come anna nagar go afternoon,0
pandy joined w technology todayhe got job,0
completed degree use joining finance,0
thanks temales wonderful thank great week,0
sometimes heart remembrs someone much forgets someone soon bcoz heart like everyone liked one remembered everytime bslvyl,0
urgent trying contact last weekend draw show u £ prize guaranteed call claim code k valid hr p pm,1
specially selected receive pound award call line close cost ppm tc apply ag promo,1
appt lttimegt fault u dont listen told u twice,0
ah poor babyhope urfeeling bettersn luv probthat overdose work hey go careful spk u sn lot lovejen xxx,0
buy one egg daplease,0
sorry battery died come im getting gram wheres place,0
prabhaim sorydarealyfrm heart im sory,0
ltdecimalgt common car better buy china asia find le expensive ill holla,0
ya im referin mei ex wat ah waitin u treat somebody shld b rich liaoso gd den u dun work frm tmr onwards,0
india win level series mean record,0
oh great ill disturb talk,0
sry dajst nw came home,0
thursday night yeah sure thing well work,0
ok ask abt e movie u wan ktv oso,0
unlimited text limited minute,0
free st week entry textpod chance win gb ipod £ cash every wk txt pod tscs wwwtextpodnet custcare,1
yes glad made,0
ltgt mca conform,0
mean still think teju,0
wow v v impressed fun shopping,0
stand away doesnt heart ache without dont wonder dont crave,0
u secret admirer looking make contact ufind rreveal think ur specialcall,1
sac need carry,0
boy loved gal propsd bt didnt mind gv lv lttrs bt frnds threw thm boy decided aproach gal dt time truck speeding towards gal wn hit girld boy ran like hell n saved asked hw cn u run fast boy replied boost secret energy n instantly girl shouted energy n thy lived happily gthr drinking boost evrydy moral story hv free msgsd gud ni,0
make lasagna vodka,0
computer fried essential part dont keep spare fucking idiot roommate looovvve leaving thing running full ltgt,0
hey late ah meet,0
omg one thing another cat worm bad day end,0
dare stupid wont tell anything hear wont talk,0
important message final contact attempt important message waiting customer claim dept expires call,1
geeeee love much barely stand,0
meant middle left right,0
sm ac jsco energy high u may know channel day ur leadership skill r strong psychic reply an wquestion end reply end jsco,1
shopping eh ger toking abt syd lehhaha,0
apo mokka player,0
jordan got voted last nite,0
im reading text sent meant joke read light,0
reach office around ltdecimalgt amp mobile problem cannt get voice call asa ill free,0
yet chikkugoing room nw im bus,0
aldrine rakhesh ex rtm herepls callurgent,0
well there lot thing happening lindsay new year sigh bar ptbo blue heron something going,0
please call customer service representative ampm guaranteed £ cash £ prize,1
didnt see shadow get early spring yay,0
whenwhere pick,0
cant talk nowi call candont keep calling,0
hey happy birthday,0
mths half price orange line rental latest camera phone free phone mths call mobilesdirect free update orstoptxt tc,1
askd u question hour answer,0
yup wun believe wat u really neva c e msg sent shuhui,0
honeybee said im sweetest world god laughed amp said waitu havnt met person reading msg moral even god crack joke gmgngegn,0
like cheap ‘ happy splash wine make feel better,0
sorry never hear unless book one kinda jokethet really looking skinny white girl one lineyou much camera something like theyre casting look,0
u buy newspaper already,0
got new job bar airport satsgettin per hour mean lie keep touch,0
thank generally date brothas,0
told number gautham,0
want cock hubby away need real man satisfy txt wife string action txt stop end txt rec £ea otbox la w,1
ready big day tomorrow,0
lol u trust,0
nd time tried contact u u £ prize claim easy call p per minute btnationalrate,1
im work please call,0
cant pick phone right pls send message,0
please leave topicsorry telling,0
eh u send wrongly lar,0
work going min,0
boy late home father power frndship,0
u got person story,0
so amount get pls,0
long beach lor expected u dinner,0
much ur hdd casing cost,0
probably money worry thing coming due several outstanding invoice work two three month ago,0
ya srsly better yi tho,0
thought praps meant another one goodo ill look tomorrow,0
ey calm downon theacusations itxt u co iwana know wotu r doin thewend haventcn u agesring ur nething satlove j xxx,0
last chance claim ur £ worth discount voucher today text shop savamob offer mobile c savamob pobox muz £ sub,1
wait ltgt min,0
freezing home yet remember kiss mom morning love think missing yet,0
saw messageit k da,0
sound like something someone testing would sayy,0
aah bless hows arm,0
hope feeling great pls fill abiola,0
private account statement show unredeemed point call identifier code expires,1
real tho suck cant even cook whole electricity im hungry,0
dont fret ill buy ovulation test strip send wont get til like march send postal addressull alrightokay,0
whats want come online,0
u love someone dont make love u much u love much dont want loved anyone except gud nit,0
right meanwhile hows project twin comin,0
usualiam fine happy amp well,0
yes princess want please every night wish command,0
u attend ur driving lesson many time wk n day,0
strange watching nd one im bed sweet dream miss u,0
yes da plm ur office,0
way ur home,0
got outta class gon na go gym,0
important customer service announcement premier,1
kay since already,0
usf guess might well take car,0
hurt tease make cry end life die plz keep one rose grave say stupid miss u nice day bslvyl,0
please send aunty number,0
daddy bb,0
available soiree june rd,0
e msg jus u said thanks gift,0
ha must walk everywhere take tram cousin said walk vic market hotel,0
ill post lr class,0
forced eat slice im really hungry tho suck mark getting worried know im sick turn pizza lol,0
dont plan staying night prolly wont back til late,0
ok im sure time finish tomorrow wan na spend evening co would vewy vewy lubly love xxx,0
opinion jada kusruthi lovable silent spl character matured stylish simple pls reply,0
wishing great day moji told offer always speechless offer easily go great length behalf stunning exam next friday keep touch sorry,0
set place heart mind mind easily forgets heart always remember wish happy valentine day,0
great day beautiful one,0
yalru lyfu astne chikku bt innu mundhe lyf ali halla ke bilo marriageprogram edhae lyf nt yet ovr chikkuali vargu lyfu meow meowd,0
urgent please call landline complimentary lux costa del sol holiday £ cash await collection ppm sae tc james ehrr,1
chk ur belovd m dict,0
private account statement show unredeemed point call identifier code expires,1
cant pick phone right pls send message,0
sir hope day going smoothly really hoped wont bother bill cant settle month extra cash know challenging time also let know,0
hard live chat pmin choose girl connect live call cheap chat uk biggest live service vu bcmwcnxx,1
wat ü,0
thk shld b ya wana go lesson haha go one whole stretch,0
call like ltgt time oh give u hypertension oh,0
life alle moneeppolum oru pole allalo,0
per request melle melle oru minnaminunginte nurungu vettam set callertune caller press copy friend callertune,0
living simple loving also simple laughing simple winning tooo simple simple difficult,0
either way work ltgt year old hope doesnt bother,0
nicenicehow working,0
still around looking pick later,0
sir waiting call,0
see forwarding message proof,0
hi chikku send nice msg,0
haha awesome ive u couple time alls coming,0
goal arsenal henry v liverpool henry score simple shot yard pas bergkamp give arsenal goal margin min,1
much buzy,0
skallis wont play first two odi,0
ki send ltgt min,0
review keep fantastic nokia ngage game deck club nokia go wwwcnupdatescomnewsletter unsubscribe alert reply word,1
got lousy sleep kept waking every hour see cat wanted come worry cold,0
ok ü finishing soon,0
cool ill text,0
hey u still gym,0
wherres boytoy,0
dear reache room,0
k ill head min see,0
thanks understanding ive trying tell sura,0
whenevr ur sad whenevr ur gray remembr im listn watevr u wan na say jus walk wid little whileamp promise ill bring back ur smile,0
im done,0
oh haha den shld went today gee nvm la kaiez dun mind goin jazz oso scared hiphop open cant catch,0
joy father john john joy father u an th hav ltgt iq ti ia question try answer,0
sitting ard nothing lor u leh busy w work,0
nokia get win free auction take part send nokia hgsuitelands rowwjhl,1
get door im,0
anytime,0
coming day class,0
problem baby good time talk called left message,0
wasnt enough trouble sleeping,0
movie laptop,0
tried call reply sm video mobile min unlimited text free camcorder reply call,1
whats bruv hope great break rewarding semester,0
okay wait ah,0
senthil group company apnt pm,0
probably want pick,0
tuesday night r u real,0
trust even isnt,0
im arestaurant eating squid wan na dosomething late,0
always putting business put picture as facebook one open people ive ever met would think picture room would hurt make feel violated,0
going nothing greatbye,0
yes outside like hour called whole family wake cause started,0
ill see swing bit got thing take care firsg,0
sorry able get see morning,0
dunno lei ü decide lor abt leona oops tot ben going n msg,0
dont flatter tell man mine two pint carlin ten minute please,0
sir receive account another hr time sorry delay,0
hellohow u doingwhat u u b moving flat co need arrange pick lamp etc take care hello caroline,0
creepy crazy,0
today vodafone number ending selected receive £ award number match call receive £ award,1
ay wana meet satü wkg sat,0
hi babe jordan r u im home abroad lonely text back u wan na chat xxsp visionsmscom text stop stopcost p,1
number vivek,0
hey mr going sea view couple gay mean game give bell ya finish,0
themobhit link get premium pink panther game new sugababes crazy zebra animation badass hoody wallpaperall free,1
hi test ltgt rd,0
come people,0
went fast asleep deartake care,0
please call customer service representative freephone ampm guaranteed £ cash £ prize,1
emailed yifeng part oredi ü get fr,0
hey something came last min think wun signing tmr hee,0
theoretically yeah could able come,0
world famamus,0
kall bestcongrats,0
hi darlin ive got back really nice night thanks much lift see u tomorrow xxx,0
ok,0
thanx today cer nice catch ave find time often oh well take care c u soonc,0
‘ give flying monkey wot think certainly ‘ mind friend mine,0
yeah usual guy town therere definitely people around know,0
alrite jod hows revision goin keris bin doin smidgin n e way u wan na cum collegexx,0
ok thanx,0
tell theyre female v howre throwing deciding get,0
kkim also finewhen complete course,0
probably earlier station think,0
lmao know well,0
love cuddle want hold strong arm right,0
way send shade stuff wonderful,0
dont shall buy one dear,0
lol know theyre dramatic school already closed tomorrow apparently cant drive inch snow supposed get,0
printer cool mean groovy wine groovying,0
r u continent,0
ur ringtone service changed free credit go clubmobilescom choose content stop txt club stop pwk club po box mk wt,1
lol grin im babe thanks thinking,0
much u trying get,0
know ltgt ill around,0
im meeting darren,0
sorry ill call later,0
aaooooright work,0
im working technical support voice process,0
best watch say cause get drunk motherfucker,0
message food,0
compliment away system side,0
de call time ill tell k,0
wat time u wan meet later,0
married local woman looking discreet action real match instantly phone text match msg cost p stop txt stop bcmsfwcnxx,1
oh shit thought trip loooooool make much sense grin sofa reference sleep couch link sent wasnt went trip oh didnt babe go celebration rent,0
nimbomsons yep phone know one obviously co thats real word,0
hi please get ltgt dollar loan ill pay back mid february pls,0
sent scream moan bed princess,0
uncle abbey happy new year abiola,0
tomarrow want got court ltdecimalgt come bus stand,0
prabhaim sorydarealyfrm heart im sory,0
unbelievable faglord,0
ok come ur home half hour,0
wake since checked stuff saw true available space pls call embassy send mail,0
bank granite issue strongbuy explosive pick member nasdaq symbol cdgt per,1
got tallent wasting,0
well welp sort semiobscure internet thing,0
hi im sorry missed call pls call back,0
hmm yeah grooved im looking forward pound special,0
got new year co yetunde said wanted surprise didnt see money returned mid january ltgt day return period ended,0
also north carolina texas atm would go gre site pay test result sent,0
cal sir meeting,0
dont necessarily expect done get back though im headin,0
ok lor,0
studying ill free next weekend,0
yes replied mail im going management office later plus bank later alsoor wednesday,0
yes completely formclark also utter waste,0
thank u better work cause feel used otherwise,0
stop however suggest stay someone able give or every stool,0
forwarded free entry £ weekly comp send word enter tc wwwtextcompcom,1
usualiam fine happy amp well,0
sweet well princess please tell like dislike bed,0
lol ok ill try send warned sprint dead slow youll prolly get tomorrow,0
hows queen going royal wedding,0
sch neva mind u eat st lor,0
ltgt min stop somewhere first,0
cheer card time year already,0
great princess thinking,0
dont think need yellow card uk travel ask someone gone ltgt buck,0
well great weekend,0
dorothykiefercom bank granite issue strongbuy explosive pick member nasdaq symbol cdgt per,1
want snow freezing windy,0
say slowly godi love amp need youclean heart bloodsend ten special people amp u c miracle tomorrow itplspls,0
yar tot u knew dis would happen long ago already,0
lol wtf random btw lunch break,0
please ask mummy call father,0
aiyo please ü got time meh,0
different style,0
wow youre right didnt mean guess gave boston men changed search location nyc something changed cuz signin page still say boston,0
£ price claim call,1
new mobile must go txt nokia collect todayfrom £ wwwtcbiz optout gbpmtmsg,1
si think waste rr,0
realy sorryi dont recognise number confused r u please,0
slaaaaave must summon time dont wish come anymore,0
yup paragon havent decided whether cut yet hee,0
please call immediately urgent message waiting,1
ive got ten buck jay noncomittal,0
going goodno problembut still need little experience understand american customer voice,0
much eighth,0
ever notice youre driving anyone going slower idiot everyone driving faster maniac,1
dont know exactly could ask chechi,0
hi moved pub would great c u u cud come,0
would great well guild could meet bristol road somewhere get touch weekend plan take flight good week,0
ok,0
keeping away like,0
please give u connection today ltdecimalgt refund bill,0
otherwise part time job natuition,0
long time remember today,0
lol happens vega stay vega,0
im going dinner soon,0
sure thing big man hockey election ‘ go longer hour though,0
know dad back,0
dun cut short leh u dun like ah failed shes quite sad,0
account credited free text message activate txt word credit tc wwwbiz,1
wondering would okay call uncle john let know thing nigeria r ltgt dollar year sent know strain plan pay back every dime give every dime expect anything practical something like,0
say hi get as back south tampa preferably kegger,0
yun ahthe ubi one say ü wan call tomorrowcall look ireneere got bus ubi cresubi tech parkph st wkg daysèn,0
class ltgt reunion,0
free call sir waiting,0
sorry cant text amp drive coherently see twenty,0
urgent trying contact u today draw show £ prize guaranteed call land line claim validhrs,1
wot wed nite til,0
im sick im needy want pout stomp foot pout stomp foot want slave want,0
sorry ill call later,0
time coming later,0
er yeah b sorry tell pubcafe sit come wen u,0
hi hope good day better night,0
ok stay night xavier sleeping bag im getting tired,0
spook mob halloween collection logo pic message plus free eerie tone txt card spook zed p per logopic,1
dear take care reaching homelove u lot,0
thats honeymoon outfit,0
somewhr someone surely made u god decided perfect time make u meet dat person till den enjoy ur crush,0
lol gon na last month cashed left ltgt case collecting week cause announced blog,0
christmas occasion celebrated reflection ur value desire affectionsamp tradition ideal christmas,0
big chic common declare,0
nd time tried contact u u £ prize claim call b tcsstop sm ppm,1
lol oh babe wont sliding place midnight thanks invite,0
poyyarikaturkolathupalayamunjalur posterode dis ltgt,0
cps causing outage conserve energy,0
wine flowing im nevering,0
costa del sol holiday £ await collection call toclaim sae tc pobox stockport skxh cost£pm maxmins,1
im movie collect car oredi,0
called said himthen choose future,0
im diet ate many slice pizza yesterday ugh im always diet,0
yo howz u girl never rang india l,0
yes rent expensive way save,0
holding,0
hows loverboy keep coming queen hmmm doesnt ache speak miss desparately,0
ü mean confirmed tot juz say oni ok,0
get garden ready summer free selection summer bulb seed worth £ scotsman saturday stop go notxtcouk,1
class hour sorry,0
great getting worried know wonderful caring person like best life know u r wonderful god love,0
alright babe justthought id sayhey u doinnearly endof wk offdam nevamindwe hook sn uwant lovejen x,0
r u meeting da ge nite tmr,0
hot live fantasy call p per min ntt ltd po box croydon cr wb k,1
thinkin someone good drug,0
come u got nothing,0
looked addie go back monday suck,0
lord ringsreturn king store nowreply lotr june chance win lotr soundtrack cd stdtxtrate reply stop end txts,1
saturday sunday holiday difficult,0
hui xin da lib,0
fine imma get drink somethin want come find,0
sent de webadres geting salary slip,0
lol wont feel bad use money take steak dinner,0
tell drug dealer getting impatient,0
supposed wake gt,0
dunno close oredi ü v fan,0
hey going lo lesson gym,0
get garden ready summer free selection summer bulb seed worth £ scotsman saturday stop go notxtcouk,1
one best dialogue cute reltnship wen die dont come near body bcoz hand may come wipe ur tear timegud ni,0
pls come quick cant bare,0
sir late paying rent past month pay ltgt charge felt would inconsiderate nag something give great cost thats didnt speak however recession wont able pay charge month hence askin well ahead month end please help thanks,0
upgrdcentre orange customer may claim free camera phone upgrade loyalty call offer end th july tc apply optout available,1
ok,0
dawhats plan,0
movie theatre go watch unlimited movie pay,0
pls whats full name joke school co fee university florida seem actually ltgt k pls holla back,0
thanks fill complete calm reassurance,0
u goin nite,0
im chennai velachery,0
family happiness,0
probably come everybodys done around ltgt right,0
oh ic thought meant mary jane,0
oh dang didnt mean send lol,0
nope ill come online,0
good good billy mate gone jogging enjoy concert,0
co lar im ba dao ok pm lor u never ask go ah said u would ask fri said u ask today,0
lot used one babe model doesnt help youi bring hell match,0
goodnight sleep well da please take care pa please,0
sleepingand surfing,0
worse us half way stop better complete,0
jesus christ bitch im trying give drug answer fucking phone,0
suck got planned yo valentine yo valentine arent,0
picking various point,0
lol real told dad cancer,0
cashbincouk get lot cash weekend wwwcashbincouk dear welcome weekend got biggest best ever cash give away,1
ur chance win £ wkly shopping spree txt shop tscs wwwtxtshopcom custcare xpwk,1
